{
  "@context": [
    "https://www.w3.org/2018/credentials/v1",
    "https://w3id.org/security/suites/ed25519-2020/v1"
  ],
  "id": "0xf275c2e31cae9462b6ca923fb5059c164c4b90b67a77e4160e40f7d69546a865",
  "type": ["VerifiableCredential"],
  "credentialSubject": {
    "id": "did:litentry:substrate:0x3a2647fe0ecd1fe0d450fd8650cd8bf3536ecac77b6e8ec2df1b5f5fc9d62931",
    "description": "You got the Top Award of community contest.",
    "type": "Litentry & Contest Legend",
    "assertions": [{ "src": "$is_contest_legend", "op": "==", "dst": "true" }],
    "values": [false],
    "endpoint": "http://localhost:9933"
  },
  "issuer": {
    "id": "did:litentry:substrate:0xd2ca10cdb1886f99f72273aa502357dfe60b8a16d0e94974c988cf19546facc2",
    "name": "Litentry TEE Worker",
    "mrenclave": "MsSostcy6BCmtFzk4DGuXxqQsnqXx9EgKCZ6vHLts2p"
  },
  "issuanceDate": "2023-12-27T17:23:54.057204342+00:00",
  "proof": {
    "created": "2023-12-27T17:23:54.057701918+00:00",
    "type": "Ed25519Signature2020",
    "proofPurpose": "assertionMethod",
    "proofValue": "45ac723de934358c79826cf2c8f2e92429ee1d59bc7069dc0026bf7116135d519cc9cd88ec4bda6213138686e44e00b7d1bfcbdfe047c4c30412af77bf890808",
    "verificationMethod": "0xd2ca10cdb1886f99f72273aa502357dfe60b8a16d0e94974c988cf19546facc2"
  }
}
