{
  "@context": [
    "https://www.w3.org/2018/credentials/v1",
    "https://w3id.org/security/suites/ed25519-2020/v1"
  ],
  "id": "0x43e4f8908c32e50a9a08645241a558d57ede2dbfc95a30f9257e844ef441d633",
  "type": ["VerifiableCredential"],
  "credentialSubject": {
    "id": "did:litentry:substrate:0x3a2647fe0ecd1fe0d450fd8650cd8bf3536ecac77b6e8ec2df1b5f5fc9d62931",
    "description": "You got the Popularity Award of community contest.",
    "type": "Litentry & Popularity Award of Score Contest",
    "assertions": [
      { "src": "$is_contest_popularity", "op": "==", "dst": "true" }
    ],
    "values": [false],
    "endpoint": "http://localhost:9933"
  },
  "issuer": {
    "id": "did:litentry:substrate:0xd2ca10cdb1886f99f72273aa502357dfe60b8a16d0e94974c988cf19546facc2",
    "name": "Litentry TEE Worker",
    "mrenclave": "MsSostcy6BCmtFzk4DGuXxqQsnqXx9EgKCZ6vHLts2p"
  },
  "issuanceDate": "2023-12-27T17:25:00.150406618+00:00",
  "proof": {
    "created": "2023-12-27T17:25:00.150831108+00:00",
    "type": "Ed25519Signature2020",
    "proofPurpose": "assertionMethod",
    "proofValue": "45ac723de934358c79826cf2c8f2e92429ee1d59bc7069dc0026bf7116135d519cc9cd88ec4bda6213138686e44e00b7d1bfcbdfe047c4c30412af77bf890808",
    "verificationMethod": "0xd2ca10cdb1886f99f72273aa502357dfe60b8a16d0e94974c988cf19546facc2"
  }
}
